{
  "$id": "https://raw.githubusercontent.com/luisitin/Documents/main/cuban-immigration-tracker/data/schema/alert-candidates.schema.json",
  "$schema": "https://json-schema.org/draft/2020-12/schema",
  "items": {
    "additionalProperties": {},
    "properties": {
      "docketNumber": {
        "minLength": 1,
        "pattern": "\\S",
        "type": "string"
      },
      "foundAt": {
        "pattern": "^\\d{4}-\\d{2}-\\d{2}T([01]\\d|2[0-3]):[0-5]\\d:[0-5]\\d(\\.\\d+)?Z$",
        "type": "string"
      },
      "id": {
        "minLength": 1,
        "pattern": "\\S",
        "type": "string"
      },
      "matchedTerms": {
        "items": {
          "minLength": 1,
          "pattern": "\\S",
          "type": "string"
        },
        "type": "array"
      },
      "source": {
        "enum": [
          "uscis.monthly_csv",
          "uscis.quarterly_all_forms",
          "uscis.i485_by_office",
          "uscis.portal_index",
          "mirror.visualizer",
          "mirror.jzebedee",
          "uscis.historic_pt",
          "fr.api",
          "courtlistener.v4",
          "uscis.rss",
          "curated",
          "bundled_sample"
        ],
        "type": "string"
      },
      "title": {
        "minLength": 1,
        "pattern": "\\S",
        "type": "string"
      },
      "url": {
        "pattern": "^https?:\\/\\/\\S+$",
        "type": "string"
      }
    },
    "required": [
      "id",
      "foundAt",
      "source",
      "title",
      "url",
      "matchedTerms"
    ],
    "type": "object"
  },
  "title": "alert-candidates",
  "type": "array",
  "x-generatedBy": "scripts/export-schema.mjs (@caa/data-schemas v1)"
}
