[
  {
    "id": "rss:08c7b80f6da9b6c1",
    "foundAt": "2026-10-21T02:53:11Z",
    "source": "uscis.rss",
    "title": "USCIS Updates Guidance and Clarifies Policy on Family-Based Conditional Permanent Residence",
    "url": "https://www.uscis.gov/newsroom/alerts/uscis-updates-guidance-and-clarifies-policy-on-family-based-conditional-permanent-residence",
    "matchedTerms": [
      "adjudication"
    ]
  },
  {
    "id": "rss:143e44737a396fa8",
    "foundAt": "2026-10-21T02:53:11Z",
    "source": "uscis.rss",
    "title": "Cuban Alien Convicted for International Alien Smuggling and Money Laundering Conspiracy",
    "url": "https://www.uscis.gov/newsroom/news-releases/cuban-alien-convicted-for-international-alien-smuggling-and-money-laundering-conspiracy",
    "matchedTerms": [
      "Cuban"
    ]
  },
  {
    "id": "rss:1495d651715fd53f",
    "foundAt": "2026-10-21T02:53:11Z",
    "source": "uscis.rss",
    "title": "Eligible Ukrainians Can Now Apply for Re-Parole - Ukrianian",
    "url": "https://www.uscis.gov/newsroom/alerts/eligible-ukrainians-can-now-apply-for-re-parole-ukrianian",
    "matchedTerms": [
      "parole"
    ]
  },
  {
    "id": "rss:185b19a798829482",
    "foundAt": "2026-10-21T02:53:11Z",
    "source": "uscis.rss",
    "title": "USCIS Implements New Immigration Parole Fee Required by H.R. 1",
    "url": "https://www.uscis.gov/newsroom/alerts/uscis-implements-new-immigration-parole-fee-required-by-hr-1",
    "matchedTerms": [
      "parole"
    ]
  },
  {
    "id": "rss:1e64d6556d92c019",
    "foundAt": "2026-10-21T02:53:11Z",
    "source": "uscis.rss",
    "title": "Court Order on Hold Policies",
    "url": "https://www.uscis.gov/newsroom/alerts/court-order-on-hold-policies",
    "matchedTerms": [
      "hold"
    ]
  },
  {
    "id": "rss:43fe8097018e14e0",
    "foundAt": "2026-10-21T02:53:11Z",
    "source": "uscis.rss",
    "title": "Cuban Alien Arrested for Unlawfully Voting",
    "url": "https://www.uscis.gov/newsroom/news-releases/cuban-alien-arrested-for-unlawfully-voting",
    "matchedTerms": [
      "Cuban"
    ]
  },
  {
    "id": "rss:58681df9cf6f21f5",
    "foundAt": "2026-10-21T02:53:11Z",
    "source": "uscis.rss",
    "title": "Recent Court Order on Hold Policies",
    "url": "https://www.uscis.gov/newsroom/alerts/recent-court-order-on-hold-policies",
    "matchedTerms": [
      "hold"
    ]
  },
  {
    "id": "rss:643db07bbd3c69e8",
    "foundAt": "2026-10-21T02:53:11Z",
    "source": "uscis.rss",
    "title": "Cuban Alien Sentenced for Role in International Alien Smuggling, Asylum Fraud, and Money Laundering Conspiracy",
    "url": "https://www.uscis.gov/newsroom/news-releases/cuban-alien-sentenced-for-role-in-international-alien-smuggling-asylum-fraud-and-money-laundering",
    "matchedTerms": [
      "Cuban"
    ]
  },
  {
    "id": "rss:726c65399822003b",
    "foundAt": "2026-10-21T02:53:11Z",
    "source": "uscis.rss",
    "title": "Cuban Alien Pleads Guilty to Role in International Alien Smuggling, Asylum Fraud, and Money Laundering Conspiracy",
    "url": "https://www.uscis.gov/newsroom/news-releases/cuban-alien-pleads-guilty-to-role-in-international-alien-smuggling-asylum-fraud-and-money-laundering",
    "matchedTerms": [
      "Cuban"
    ]
  },
  {
    "id": "rss:7cb4cc3fbdbfe656",
    "foundAt": "2026-10-21T02:53:11Z",
    "source": "uscis.rss",
    "title": "USCIS Extends Parole by Two Years for Certain Afghan Nationals Under Age 14",
    "url": "https://www.uscis.gov/newsroom/alerts/uscis-extends-parole-by-two-years-for-certain-afghan-nationals-under-age-14",
    "matchedTerms": [
      "parole"
    ]
  },
  {
    "id": "rss:a049b665beb78057",
    "foundAt": "2026-10-21T02:53:11Z",
    "source": "uscis.rss",
    "title": "Cuban Air Force Pilot Indicted for Immigration Fraud",
    "url": "https://www.uscis.gov/newsroom/news-releases/cuban-air-force-pilot-indicted-for-immigration-fraud",
    "matchedTerms": [
      "Cuba",
      "Cuban"
    ]
  },
  {
    "id": "rss:a149680f73f7c603",
    "foundAt": "2026-10-21T02:53:11Z",
    "source": "uscis.rss",
    "title": "First 100 Days: USCIS Delivering on Making America Safe Again",
    "url": "https://www.uscis.gov/newsroom/news-releases/first-100-days-uscis-delivering-on-making-america-safe-again",
    "matchedTerms": [
      "parole"
    ]
  },
  {
    "id": "rss:b2bb1ab7b944b500",
    "foundAt": "2026-10-21T02:53:11Z",
    "source": "uscis.rss",
    "title": "Update on Form I-134A",
    "url": "https://www.uscis.gov/newsroom/alerts/update-on-form-i-134a",
    "matchedTerms": [
      "parole",
      "pause"
    ]
  },
  {
    "id": "rss:bd79a40bfe874b3a",
    "foundAt": "2026-10-21T02:53:11Z",
    "source": "uscis.rss",
    "title": "USCIS to Consider Anti-Americanism in Immigrant Benefit Requests",
    "url": "https://www.uscis.gov/newsroom/news-releases/uscis-to-consider-anti-americanism-in-immigrant-benefit-requests",
    "matchedTerms": [
      "parole",
      "adjudication"
    ]
  },
  {
    "id": "rss:be89ec6cbd1dce48",
    "foundAt": "2026-10-21T02:53:11Z",
    "source": "uscis.rss",
    "title": "Reminders on the Process to Promote the Unity and Stability of Families",
    "url": "https://www.uscis.gov/newsroom/alerts/reminders-on-the-process-to-promote-the-unity-and-stability-of-families",
    "matchedTerms": [
      "parole"
    ]
  },
  {
    "id": "rss:c1d28eb2bf9d27ae",
    "foundAt": "2026-10-21T02:53:11Z",
    "source": "uscis.rss",
    "title": "Eligible Ukrainians Can Now Apply for Re-Parole",
    "url": "https://www.uscis.gov/newsroom/alerts/eligible-ukrainians-can-now-apply-for-re-parole",
    "matchedTerms": [
      "parole"
    ]
  },
  {
    "id": "rss:c61afc945b656c00",
    "foundAt": "2026-10-21T02:53:11Z",
    "source": "uscis.rss",
    "title": "Court Order on Diversity Immigrant Visa Program Hold Policy",
    "url": "https://www.uscis.gov/newsroom/alerts/court-order-on-diversity-immigrant-visa-program-hold-policy",
    "matchedTerms": [
      "hold",
      "adjudication",
      "PM-602"
    ]
  },
  {
    "id": "rss:c929093a66baea58",
    "foundAt": "2026-10-21T02:53:11Z",
    "source": "uscis.rss",
    "title": "DHS Ends the Abuse of the Humanitarian Parole Process and Terminates Family Reunification Parole Programs",
    "url": "https://www.uscis.gov/newsroom/alerts/dhs-ends-the-abuse-of-the-humanitarian-parole-process-and-terminates-family-reunification-parole",
    "matchedTerms": [
      "Cuba",
      "parole"
    ]
  },
  {
    "id": "rss:d1f7744eeded5f82",
    "foundAt": "2026-10-21T02:53:11Z",
    "source": "uscis.rss",
    "title": "Eligible Ukrainians Can Now Apply for Re-Parole - Russian",
    "url": "https://www.uscis.gov/newsroom/alerts/eligible-ukrainians-can-now-apply-for-re-parole-russian",
    "matchedTerms": [
      "parole"
    ]
  },
  {
    "id": "rss:e2b1ef2fefefdaf2",
    "foundAt": "2026-10-21T02:53:11Z",
    "source": "uscis.rss",
    "title": "USCIS Assists in Investigation of Cuban National Indicted on Charges Related to Credit Card “Skimming” and Lying on a Naturalization Application",
    "url": "https://www.uscis.gov/newsroom/news-releases/uscis-assists-in-investigation-of-cuban-national-indicted-on-charges-related-to-credit-card-skimming",
    "matchedTerms": [
      "Cuban"
    ]
  },
  {
    "id": "rss:e94d7c9685aaf11a",
    "foundAt": "2026-10-21T02:53:11Z",
    "source": "uscis.rss",
    "title": "USCIS Updates Guidance for Special Immigrant Juvenile Petitions",
    "url": "https://www.uscis.gov/newsroom/alerts/uscis-updates-guidance-for-special-immigrant-juvenile-petitions",
    "matchedTerms": [
      "adjudication"
    ]
  },
  {
    "id": "rss:ee52ad7a3e967b16",
    "foundAt": "2026-10-21T02:53:11Z",
    "source": "uscis.rss",
    "title": "Litigation-Related Update: Supreme Court stay of CHNV Preliminary Injunction",
    "url": "https://www.uscis.gov/newsroom/alerts/litigation-related-update-supreme-court-stay-of-chnv-preliminary-injunction",
    "matchedTerms": [
      "Cuban",
      "parole"
    ]
  }
]
